asin,title,category,price,image_url,amazon_url,features,description,slug
B0DR5PDH79,"Amazon Basics Cat Cave Bed, 2-in-1 Foldable House for Indoor Cats, with Washable Cushion and Non-Slip Base, 15 x 15 Inches, Small",Beds,22.93,https://m.media-amazon.com/images/I/81KSXnH-2GL._AC_UL320_.jpg,https://www.amazon.com/dp/B0DR5PDH79?tag=captaincatnip-20,Trusted Amazon-listed product|Highly rated by cat owners|Ships fast via Amazon,"Amazon Basics Cat Cave Bed, 2-in-1 Foldable House for Indoor Cats, with Washable Cushion and Non-Slip Base, 15 x 15 Inches, Small — a top-rated beds pick for cat parents. Order on Amazon with fast shipping.",amazon-basics-cat-cave-bed-2-in-1-foldable-house-for-indoor-cats-with-washable-c
B09P32SSRL,"ARM & Hammer Clump & Seal Platinum Cat Litter, Multi-Cat Clumping Litter Forms Rock-Hard Clumps, Powerful Odor Eliminators with Baking Soda, 14-Day Odor Control, 18 lbs",Litter,17.99,https://m.media-amazon.com/images/I/8145dPimX4L._AC_UL320_.jpg,https://www.amazon.com/dp/B09P32SSRL?tag=captaincatnip-20,Trusted Amazon-listed product|Highly rated by cat owners|Ships fast via Amazon,"ARM & Hammer Clump & Seal Platinum Cat Litter, Multi-Cat Clumping Litter Forms Rock-Hard Clumps, Powerful Odor Eliminators with Baking Soda, 14-Day Odor Control, 18 lbs — a top-rated litter pick for cat parents. Order on Amazon with fast shipping.",arm-hammer-clump-seal-platinum-cat-litter-multi-cat-clumping-litter-forms-rock-h
B001STPJJO,Fancy Feast Poultry and Beef Feast Classic Pate Collection Grain Free Wet Cat Food Variety Pack - (Pack of 24) 3 oz. Cans,Food,22.86,https://m.media-amazon.com/images/I/81mxaO5jH3L._AC_UL320_.jpg,https://www.amazon.com/dp/B001STPJJO?tag=captaincatnip-20,Trusted Amazon-listed product|Highly rated by cat owners|Ships fast via Amazon,Fancy Feast Poultry and Beef Feast Classic Pate Collection Grain Free Wet Cat Food Variety Pack - (Pack of 24) 3 oz. Cans — a top-rated food pick for cat parents. Order on Amazon with fast shipping.,fancy-feast-poultry-and-beef-feast-classic-pate-collection-grain-free-wet-cat-fo
B07SYVPK7B,"Greenies Feline Smartbites, Cat Treats Healthy Recipe, Indoor Cat Treats, Tuna Flavor, 16 oz. Tub",Treats,19.98,https://m.media-amazon.com/images/I/81VFyakVvBL._AC_UL320_.jpg,https://www.amazon.com/dp/B07SYVPK7B?tag=captaincatnip-20,Trusted Amazon-listed product|Highly rated by cat owners|Ships fast via Amazon,"Greenies Feline Smartbites, Cat Treats Healthy Recipe, Indoor Cat Treats, Tuna Flavor, 16 oz. Tub — a top-rated treats pick for cat parents. Order on Amazon with fast shipping.",greenies-feline-smartbites-cat-treats-healthy-recipe-indoor-cat-treats-tuna-flav
B0GQBGTQTQ,18L/4.76 Gal Extra Large Dog Water Fountain Stainless Steel Quiet Pet Automatic Water Fountain for Large Dogs with Deeper Wider Drinking Bowl and Visible Level Window for Multi-pet Household,Feeders,76.99,https://m.media-amazon.com/images/I/71pEZa+RfUL._AC_UL320_.jpg,https://www.amazon.com/dp/B0GQBGTQTQ?tag=captaincatnip-20,Trusted Amazon-listed product|Highly rated by cat owners|Ships fast via Amazon,18L/4.76 Gal Extra Large Dog Water Fountain Stainless Steel Quiet Pet Automatic Water Fountain for Large Dogs with Deeper Wider Drinking Bowl and Visible Level Window for Multi-pet Household — a top-rated feeders pick for cat parents. Order on Amazon with fast shipping.,18l-4-76-gal-extra-large-dog-water-fountain-stainless-steel-quiet-pet-automatic
B0FJCQ5GWH,Vivicreate Large Cat Backpack Carrier for Travel and Hiking Transparent Pet Bubble Backpack for Cats up to 20lbs with Ventilation and Padded Straps Mochila para Gatos transportadora mascotas (Pink),Carriers,21.99,https://m.media-amazon.com/images/I/81mx+-Q4DLL._AC_SL1500_.jpg,https://www.amazon.com/dp/B0FJCQ5GWH?tag=captaincatnip-20,"🔥✔️ Transparent Front Bubble Design Lets your cat enjoy the view while reducing anxiety in unfamiliar environments. Diseño frontal transparente que permite a tu gato ver el exterior y reduce el estrés.|🔥✔️ Breathable and Ventilated Equipped with multiple air holes and mesh sides to promote airflow and prevent overheating. Con orificios de aire y laterales de malla para garantizar una ventilación adecuada.|🔥✔️ Ergonomic Shoulder Straps with Chest Buckle Adjustable padded straps reduce pressure on your shoulders for comfortable long-term wear. Tirantes acolchados y ajustables con hebilla de pecho para mayor comodidad al llevarla.|🔥✔️ Spacious and Durable Build Holds pets up to 13 lbs with a sturdy base and scratch-resistant shell. Espaciosa y resistente, soporta mascotas de hasta 6 kg sin deformarse.|🔥✔️ Multipurpose for Travel and Daily Use Perfect for travel, outdoor walks, hiking, and vet visits—stylish and functional. Ideal para viajes, caminatas, visitas al veterinario y uso diario.",🔥✔️ Transparent Front Bubble Design Lets your cat enjoy the view while reducing anxiety in unfamiliar environments. Diseño frontal transparente que permite a tu gato ver el exterior y reduce el estrés. 🔥✔️ Breathable and Ventilated Equipped with multiple air holes and mesh sides to promote airflow and prevent overheating. Con orificios de aire y laterales de malla para garantizar una ventilación adecuada.,vivicreate-large-cat-backpack-carrier-for-travel-and-hiking-transparent-pet-bubb
B0921T6QFC,"MECOOL 34” Tall Cat Scratching Post Premium Basics Kitten Scratcher Sisal Scratch Posts Trees with Hanging Ball for Indoor Cats, Beige",Scratchers,22.49,https://m.media-amazon.com/images/I/61NyTXaUWOS._AC_UL320_.jpg,https://www.amazon.com/dp/B0921T6QFC?tag=captaincatnip-20,Trusted Amazon-listed product|Highly rated by cat owners|Ships fast via Amazon,"MECOOL 34” Tall Cat Scratching Post Premium Basics Kitten Scratcher Sisal Scratch Posts Trees with Hanging Ball for Indoor Cats, Beige — a top-rated scratchers pick for cat parents. Order on Amazon with fast shipping.",mecool-34-tall-cat-scratching-post-premium-basics-kitten-scratcher-sisal-scratch
B0DLRH694Y,"BABORUI Interactive Cat Toy Ball - Automatic Interactive Cat Toys for Indoor Cats with 3 Tails, 2 Speeds Rechargeable Cat Enrichment Toys for Small/Medium/Large Cats to Keep Them Busy(Blue)",Toys,9.98,https://m.media-amazon.com/images/I/71WDlQPY9uL._AC_SL1500_.jpg,https://www.amazon.com/dp/B0DLRH694Y?tag=captaincatnip-20,"A NEW CHOICE FOR INDOOR ENTERTAINMENT: Endless fun for your cat! Designed for indoor environments, this interactive toy ball rolls quickly across the carpet and emits an appealing cat-attracting chittering sound. Not only does it stimulate your cat's hunting instincts, it also allows them to enjoy outdoor chasing indoors while reducing the risk of furniture scratching|INTELLIGENT INTERACTION AND FUN: This automatic cat toy is your pet's new playmate. It has two modes: ① Normal mode (green light), which runs for five minutes and then automatically shuts off. ② Intelligent mode (blue light), after running for five minutes the exercise ball automatically enters the dormant mode, when your cat touches it again, the exerciser will interact with your cat again. So whether it's a long game or a short interaction, this interactive cat ball meets the needs of both you and your pet, allowing your pet to entertain itself while you're busy|TWO SPEEDS FREELY SWITCHING: The BABORUI interactive cat toy offers two speeds, fast and slow, which can be freely switched at any time. Even if your cat is cute and short-legged, it can still keep up with the pace of the exercise ball|TRIPLE FUN, TRIPLE HAPPINESS: This cat toys for indoor cats comes with three fun tails that provide your cat with triple the fun. They can have endless fun chasing and catching the ball, while the sound of the bells on the tails will further stimulate their curiosity and desire to chase|SAFE MATERIAL, LASTING AND DURABLE: We understand that your pet's safety is of utmost importance to you. The shell of this kitten toys is made of safe silicone material, so you don't need to worry even if your pet chews it. The durable design means it can withstand daily wear and tear, providing long-lasting companionship for you and your pet","A NEW CHOICE FOR INDOOR ENTERTAINMENT: Endless fun for your cat! Designed for indoor environments, this interactive toy ball rolls quickly across the carpet and emits an appealing cat-attracting chittering sound. Not only does it stimulate your cat's hunting instincts, it also allows them to enjoy outdoor chasing indoors while reducing the risk of furniture scratching INTELLIGENT INTERACTION AND FUN: This automatic cat toy is your pet's new playmate. It has two modes: ① Normal mode (green light), which runs for five minutes and then automatically shuts off. ② Intelligent mode (blue light), aft",baborui-interactive-cat-toy-ball-automatic-interactive-cat-toys-for-indoor-cats
B0CQN6RYDY,"BEAUTYZOO Cat Harness and Leash Set for Walking Escape Proof, Neck Release Adjustable Harness for Kitten Puppy Small Medium Large Cats, Soft Cute Easy Control Small Cat Harness for Cats Boy and Girls",Collars,15.19,https://m.media-amazon.com/images/I/717Px8ou7fL._AC_UL320_.jpg,https://www.amazon.com/dp/B0CQN6RYDY?tag=captaincatnip-20,Trusted Amazon-listed product|Highly rated by cat owners|Ships fast via Amazon,"BEAUTYZOO Cat Harness and Leash Set for Walking Escape Proof, Neck Release Adjustable Harness for Kitten Puppy Small Medium Large Cats, Soft Cute Easy Control Small Cat Harness for Cats Boy and Girls — a top-rated collars pick for cat parents. Order on Amazon with fast shipping.",beautyzoo-cat-harness-and-leash-set-for-walking-escape-proof-neck-release-adjust
B07H3WN2B7,"from The Field | Fine Ground Stalkless Catnip | Premium USA-Grown Catnip for Toys & Playtime | Fresh, Potent, Non-Toxic, Eco-Friendly | Safe for Kittens & Cats | Resealable 10 Oz Bag",Catnip,18.99,https://m.media-amazon.com/images/I/91HNkaAJX8L._AC_SL1500_.jpg,https://www.amazon.com/dp/B07H3WN2B7?tag=captaincatnip-20,"CAPTIVATE YOUR CAT with aromatic From the Field Catnip. Fresh, potent and non-toxic, it gives your feline a euphoric feeling that may help ease stress and encourage exercise for overall well-being.|SMOOTH, STALKLESS cat nip has been finely ground to a velvety texture from mature cat grass. From the Field Catnip is packed with full-bodied essential oils and blooms that contain natural Nepetalactone.|GROWN IN THE USA in picturesque Washington State, our catnip offers safe cat entertainment. It can be used to refresh your pet’s favorite catnip toys or as a non-calorie alternative to cat treats.|FRESH AND POTENT From the Field Catnip comes in a resealable container to prolong its powerful effects. A pinch provides hours of fun and dissuades your cat from shredding furniture out of boredom.|FOR ALL AGES of kittens and cats, our enthralling cat nip is a must-have addition to new kitten accessories. Promoting physical activity, it also belongs among your cat essentials for indoor cats.","Experience the finesse of our Fine Ground Stalkless Catnip, a meticulously crafted blend of leaves and flowers with minimal stem content (under 2mm), perfect for enhancing your cat's toys and playtime. This fine-textured catnip fits seamlessly into any toy design and is economically priced, making it ideal not only for filling toys but also for stimulating active play. The distinctive black specks are heat-sterilized catnip seeds, which promote natural growth and robust spread like their mint family relatives",from-the-field-fine-ground-stalkless-catnip-premium-usa-grown-catnip-for-toys-pl
B0FW4JR768,Cat Grooming Gloves for Shedding – Pet Hair Remover Set with Self-Cleaning Mitt – 2 Deshedding Gloves + 1 Reusable Cleaning Mitt for Cats & Dogs – Long & Short Hair Deshedder,Grooming,17.99,https://m.media-amazon.com/images/I/81I-jMhuSYL._AC_UL320_.jpg,https://www.amazon.com/dp/B0FW4JR768?tag=captaincatnip-20,Trusted Amazon-listed product|Highly rated by cat owners|Ships fast via Amazon,Cat Grooming Gloves for Shedding – Pet Hair Remover Set with Self-Cleaning Mitt – 2 Deshedding Gloves + 1 Reusable Cleaning Mitt for Cats & Dogs – Long & Short Hair Deshedder — a top-rated grooming pick for cat parents. Order on Amazon with fast shipping.,cat-grooming-gloves-for-shedding-pet-hair-remover-set-with-self-cleaning-mitt-2
B0DRVLPQ15,"FUKUMARU Cat Wall Shelves, Stable & Safe 4 in 1 Cat Walls Furniture Set, Wooden Kitten Climbing Wall with Scratching Post for 16 Inch Drywall - Beige",Furniture,69.80,https://m.media-amazon.com/images/I/81AEGQwEbKL._AC_UL320_.jpg,https://www.amazon.com/dp/B0DRVLPQ15?tag=captaincatnip-20,Trusted Amazon-listed product|Highly rated by cat owners|Ships fast via Amazon,"FUKUMARU Cat Wall Shelves, Stable & Safe 4 in 1 Cat Walls Furniture Set, Wooden Kitten Climbing Wall with Scratching Post for 16 Inch Drywall - Beige — a top-rated furniture pick for cat parents. Order on Amazon with fast shipping.",fukumaru-cat-wall-shelves-stable-safe-4-in-1-cat-walls-furniture-set-wooden-kitt
B0GMX4ZVK1,"Sweetcrispy 54 Inch Cats Tree Tower, Multi-Level with Scratching Post, Indoor Cat Tree Condo with Climbing Ladder, Plush Toy, Play House for Kittens, Pink",Trees,37.93,https://m.media-amazon.com/images/I/61vHXsC7I5L._AC_SL1500_.jpg,https://www.amazon.com/dp/B0GMX4ZVK1?tag=captaincatnip-20,"Multi-Function Design: This grey cat tree is a versatile playground for your feline friend. With three climbable platforms, cat tower for indoor cats offers endless adventure and exploration. When it’s time to rest, the two cozy cat condos provide a warm, private haven for relaxation|Cat's Entertainment Hub: Featuring three sisal rope pillars, cat tower with scratching post satisfies natural scratching instincts while the dangling balls with bells mimic the thrill of the hunt. A thoughtfully designed climbing ramp adds an extra layer of fun to their playtime|High-Quality Material: Constructed with pet-friendly materials, this cat tree for indoor cat features thick plush fabric for comfort, natural sisal-wrapped posts for durability, and a reinforced baseboard for stability|Stable & Space-Saving: With a compact footprint of 50x50cm, this tall cat tower maximizes vertical space for 3-4 cats to play. The included anti-tilt device ensures added stability, keeping your pets safe|Easy Assembly: Assembly is a breeze with the included manual and tools. Each part is labeled with a number that corresponds to the instructions in the manual, ensuring a straightforward assembly process. Kitty tree for indoor cats takes about 40 minutes to set up, and a video tutorial is available for guidance","Multi-Function Design: This grey cat tree is a versatile playground for your feline friend. With three climbable platforms, cat tower for indoor cats offers endless adventure and exploration. When it’s time to rest, the two cozy cat condos provide a warm, private haven for relaxation Cat's Entertainment Hub: Featuring three sisal rope pillars, cat tower with scratching post satisfies natural scratching instincts while the dangling balls with bells mimic the thrill of the hunt. A thoughtfully designed climbing ramp adds an extra layer of fun to their playtime",sweetcrispy-54-inch-cats-tree-tower-multi-level-with-scratching-post-indoor-cat-2
B000IZPY3K,"VetriScience Dental Care Powder for Dogs & Cats – Helps Reduce Plaque & Tartar Buildup, Clean Teeth & Fresher Breath, Clinically Tested, Vet-Formulated Oral Supplement, 4.2 oz",Health,23.70,https://m.media-amazon.com/images/I/71CMa5+x9iL._AC_UL320_.jpg,https://www.amazon.com/dp/B000IZPY3K?tag=captaincatnip-20,Trusted Amazon-listed product|Highly rated by cat owners|Ships fast via Amazon,"VetriScience Dental Care Powder for Dogs & Cats – Helps Reduce Plaque & Tartar Buildup, Clean Teeth & Fresher Breath, Clinically Tested, Vet-Formulated Oral Supplement, 4.2 oz — a top-rated health pick for cat parents. Order on Amazon with fast shipping.",vetriscience-dental-care-powder-for-dogs-cats-helps-reduce-plaque-tartar-buildup
B078NJM2CT,"MEOWFIA Cat Cave – Premium Felt Cat Bed Enclosure for Indoor Cats, Handmade Merino Wool (Light Gray, Medium)",Beds,39.99,https://m.media-amazon.com/images/I/71Gpf-WUsVL._AC_UL320_.jpg,https://www.amazon.com/dp/B078NJM2CT?tag=captaincatnip-20,Trusted Amazon-listed product|Highly rated by cat owners|Ships fast via Amazon,"MEOWFIA Cat Cave – Premium Felt Cat Bed Enclosure for Indoor Cats, Handmade Merino Wool (Light Gray, Medium) — a top-rated beds pick for cat parents. Order on Amazon with fast shipping.",meowfia-cat-cave-premium-felt-cat-bed-enclosure-for-indoor-cats-handmade-merino
B0DJDNXZYF,"Fresh Step Heavy Duty Odor Block Advanced Multi Cat Clumping Litter with Febreze, 17.5 lb (Package May Vary)",Litter,18.40,https://m.media-amazon.com/images/I/81BcD+lbecL._AC_UL320_.jpg,https://www.amazon.com/dp/B0DJDNXZYF?tag=captaincatnip-20,Trusted Amazon-listed product|Highly rated by cat owners|Ships fast via Amazon,"Fresh Step Heavy Duty Odor Block Advanced Multi Cat Clumping Litter with Febreze, 17.5 lb (Package May Vary) — a top-rated litter pick for cat parents. Order on Amazon with fast shipping.",fresh-step-heavy-duty-odor-block-advanced-multi-cat-clumping-litter-with-febreze
B0CPP4Y1XL,"Sheba Perfect Portions Wet Cat Food Cuts in Gravy, with Sustainable Salmon, Tender Trout Entree, and with Sustainable Tuna, 2.6 oz. Twin-Pack Trays (24 Count, 48 Servings)",Food,25.96,https://m.media-amazon.com/images/I/918zrqmwgXL._AC_UL320_.jpg,https://www.amazon.com/dp/B0CPP4Y1XL?tag=captaincatnip-20,Trusted Amazon-listed product|Highly rated by cat owners|Ships fast via Amazon,"Sheba Perfect Portions Wet Cat Food Cuts in Gravy, with Sustainable Salmon, Tender Trout Entree, and with Sustainable Tuna, 2.6 oz. Twin-Pack Trays (24 Count, 48 Servings) — a top-rated food pick for cat parents. Order on Amazon with fast shipping.",sheba-perfect-portions-wet-cat-food-cuts-in-gravy-with-sustainable-salmon-tender
B08QR7XXNH,"Greenies Cat Treats, Feline Smartbites, Skin & Fur Health, Crunchy and Soft Cat Treats, Chicken Flavor, 16 oz. Tub",Treats,19.98,https://m.media-amazon.com/images/I/81FccGxvDJL._AC_UL320_.jpg,https://www.amazon.com/dp/B08QR7XXNH?tag=captaincatnip-20,Trusted Amazon-listed product|Highly rated by cat owners|Ships fast via Amazon,"Greenies Cat Treats, Feline Smartbites, Skin & Fur Health, Crunchy and Soft Cat Treats, Chicken Flavor, 16 oz. Tub — a top-rated treats pick for cat parents. Order on Amazon with fast shipping.",greenies-cat-treats-feline-smartbites-skin-fur-health-crunchy-and-soft-cat-treat
B0DDPYHHFX,Cat Water Fountain Stainless Steel: 74oz/2.2L Cat Fountain for Drinking - Pet Water Fountain for Cats Inside - Quiet Cats Water Bowl Dispenser - Kitty Drinking Fountains - for Pets& Small Animals,Feeders,19.95,https://m.media-amazon.com/images/I/71QLaRKrdvL._AC_UL320_.jpg,https://www.amazon.com/dp/B0DDPYHHFX?tag=captaincatnip-20,Trusted Amazon-listed product|Highly rated by cat owners|Ships fast via Amazon,Cat Water Fountain Stainless Steel: 74oz/2.2L Cat Fountain for Drinking - Pet Water Fountain for Cats Inside - Quiet Cats Water Bowl Dispenser - Kitty Drinking Fountains - for Pets& Small Animals — a top-rated feeders pick for cat parents. Order on Amazon with fast shipping.,cat-water-fountain-stainless-steel-74oz-2-2l-cat-fountain-for-drinking-pet-water-2
B09YYKFLMQ,"Cat Carrier Backpack, Expandable Pet Carrier with Sun Shade & Full Front Opening, Breathable Mesh Backpack for Small Dogs & Medium Cats Up to 18 Lbs, Foldable for Hiking, Camping (Grey)",Carriers,39.99,https://m.media-amazon.com/images/I/81bsYuCBn-L._AC_SL1500_.jpg,https://www.amazon.com/dp/B09YYKFLMQ?tag=captaincatnip-20,"MAXIMUM AIR CIRCULATION & MULTIPLE ENTRANCES: Mesh windows on 4 sides for optimal airflow, 4 entrances (sides, front, and back) allow your pet to enjoy the outside scenery and easy entry into the carrier, and 1 expandable soft mat to keep your pet comfy during the journey|EXPANDABLE & COLLAPSIBLE: This pet carrier backpack with an expandable back allows your pet to move around more comfortably and reduces the anxiety. And the carrier can collapse flat when not in use. Measures 13x9.8x16.5 inch, easily fits most small/medium-sized pets, weighing up to 18 lbs. Each airline sets their own specific requirements, so it is advised to check with your airline of choice|STURDY & SAFETY: Equipped with a durable rod on the top and both sides are fixed with frames to stabilize the structure, plus a firm bottom pad offers solid support for your pets. Also comes with a safety leash to prevent escape, this pet backpack carrier is sturdy and safe for your pets|COMFORT DESIGN: Made with quality and water repellent 300D Oxford fabric for long-lasting use. 2 side pockets to store pet supplies and a ROLLER BLIND can be pulled down to protect from the sun. The travel backpack carrier is portable for traveling, camping, hiking, biking, going to the vet, or walking in the park|SATISFACTION GUARANTEE: All Lekebobor pet carriers are backed by a 30-180 day solution plan for quality-related issues, as well as friendly customer service","MAXIMUM AIR CIRCULATION & MULTIPLE ENTRANCES: Mesh windows on 4 sides for optimal airflow, 4 entrances (sides, front, and back) allow your pet to enjoy the outside scenery and easy entry into the carrier, and 1 expandable soft mat to keep your pet comfy during the journey EXPANDABLE & COLLAPSIBLE: This pet carrier backpack with an expandable back allows your pet to move around more comfortably and reduces the anxiety. And the carrier can collapse flat when not in use. Measures 13x9.8x16.5 inch, easily fits most small/medium-sized pets, weighing up to 18 lbs. Each airline sets their own specifi",cat-carrier-backpack-expandable-pet-carrier-with-sun-shade-full-front-opening-br
B005GXNN5K,"SmartyKat Sisal Angle Ramp Cat Scratcher, Natural Woven Sisal Surface & Stable Wooden Structure with Organic Catnip",Scratchers,12.81,https://m.media-amazon.com/images/I/71CPKAL28YL._AC_UL320_.jpg,https://www.amazon.com/dp/B005GXNN5K?tag=captaincatnip-20,Trusted Amazon-listed product|Highly rated by cat owners|Ships fast via Amazon,"SmartyKat Sisal Angle Ramp Cat Scratcher, Natural Woven Sisal Surface & Stable Wooden Structure with Organic Catnip — a top-rated scratchers pick for cat parents. Order on Amazon with fast shipping.",smartykat-sisal-angle-ramp-cat-scratcher-natural-woven-sisal-surface-stable-wood
B0C7GMX4FT,"YVE LIFE Cat Toys Laser for Indoor Cats,The 4th Generation Real Random Trajectory Motion Activated Rechargeable Automatic Cat Laser Toy,Interactive Cat Toys for Bored Indoor Cats/Kittens",Toys,19.99,https://m.media-amazon.com/images/I/61u7uhis-3L._AC_UL320_.jpg,https://www.amazon.com/dp/B0C7GMX4FT?tag=captaincatnip-20,Trusted Amazon-listed product|Highly rated by cat owners|Ships fast via Amazon,"YVE LIFE Cat Toys Laser for Indoor Cats,The 4th Generation Real Random Trajectory Motion Activated Rechargeable Automatic Cat Laser Toy,Interactive Cat Toys for Bored Indoor Cats/Kittens — a top-rated toys pick for cat parents. Order on Amazon with fast shipping.",yve-life-cat-toys-laser-for-indoor-cats-the-4th-generation-real-random-trajector
B000OBKAHI,"PetSafe Come with Me Kitty Harness and Bungee Leash Adjustable, Lightweight Harness for Cats Medium, Lilac",Collars,16.99,https://m.media-amazon.com/images/I/61-sxaVPbXL._AC_UL320_.jpg,https://www.amazon.com/dp/B000OBKAHI?tag=captaincatnip-20,Trusted Amazon-listed product|Highly rated by cat owners|Ships fast via Amazon,"PetSafe Come with Me Kitty Harness and Bungee Leash Adjustable, Lightweight Harness for Cats Medium, Lilac — a top-rated collars pick for cat parents. Order on Amazon with fast shipping.",petsafe-come-with-me-kitty-harness-and-bungee-leash-adjustable-lightweight-harne
B01N30MZJX,"Cat Crack Catnip, Zoomie-Inducing Cat Nip Blend, North American Made & 100% Natural, Safe & Non-Addictive Catnip Treats Used to Supplement Cat Nip Toys, Spray, & Accessories (1 Cup)",Catnip,13.99,https://m.media-amazon.com/images/I/71j9I9Kj2qL._AC_SL1500_.jpg,https://www.amazon.com/dp/B01N30MZJX?tag=captaincatnip-20,"𝗣𝗢𝗣 𝗦𝗢𝗠𝗘 𝗣𝗢𝗣𝗖𝗢𝗥𝗡: because you’ll have a ring-side seat to the greatest show on earth. One hit from our cat crack gives cats a buzz that fuels a feline acrobatic frenzy.|𝗧𝗛𝗜𝗦 𝗖𝗥𝗔𝗖𝗞 𝗜𝗦𝗡'𝗧 𝗔𝗗𝗗𝗜𝗖𝗧𝗜𝗩𝗘: since it is Non-GMO and 100% natural. Cat Crack is made cleanly and reliably in North America with fair labor standards.|𝗪𝗘'𝗩𝗘 𝗚𝗢𝗧 𝗧𝗛𝗘 𝗚𝗢𝗢𝗗 𝗦𝗧𝗨𝗙𝗙: with a 78%+ Nepetalactone content. It’s the highest and most potent kitty dope commercially available.|𝗙𝗥𝗘𝗦𝗛 𝗔𝗦 𝗔 𝗗𝗜𝗠𝗘 𝗕𝗔𝗚: from climate controlled storage and sealed under the lid. Neighborhood cats are sure to appreciate this if being used for some under the hood gifts for cats.|𝗡𝗢𝗧 𝗝𝗨𝗦𝗧 𝗙𝗢𝗥 𝗣𝗟𝗔𝗬: Cat Crack can be used for cat training similar to regular cat treats and kitten treats. Introduce new cat accessories by sprinkling some Cat Crack on them. Optionally, Cat Crack can supplement a catnip ball or catnip spray.",𝗣𝗢𝗣 𝗦𝗢𝗠𝗘 𝗣𝗢𝗣𝗖𝗢𝗥𝗡: because you’ll have a ring-side seat to the greatest show on earth. One hit from our cat crack gives cats a buzz that fuels a feline acrobatic frenzy. 𝗧𝗛𝗜𝗦 𝗖𝗥𝗔𝗖𝗞 𝗜𝗦𝗡'𝗧 𝗔𝗗𝗗𝗜𝗖𝗧𝗜𝗩𝗘: since it is Non-GMO and 100% natural. Cat Crack is made cleanly and reliably in North America with fair labor standards.,cat-crack-catnip-zoomie-inducing-cat-nip-blend-north-american-made-100-natural-s
