asin,title,category,price,image_url,amazon_url,features,description,slug
B07KHPLFMS,Texsens Innovative Traveler Bubble Backpack Pet Carriers for Cats and Dogs (Black),Carriers,26.99,https://m.media-amazon.com/images/I/61tatOQzdLL._AC_SL1000_.jpg,https://www.amazon.com/dp/B07KHPLFMS?tag=captaincatnip-20,"Pet Backpack Dimensions: 12.6"" L x 11.4"" W x 16.5"" H. Perfect for dogs up to 15-pounds, or cats up to 18-pounds. Easily fits cats, small dogs, and most other small/medium-sized pets! Please make sure your pet sits within 14.5 inches overall height and 12 inches wide|Breathable & Perspective: Three side was made of PVC mesh for the carriers. Well ventilated design for optimal airflow and checking on pet|Reduce shoulder weight: This cat carrier backpack comes with chest buckles which helps to reduce the burden and keeps the shoulder straps from slipping while pet moving|Keep your pet comfortable: Removable cosy mat for easier cleaning and let your pet enjoy it inside|Last Long Using and Easy Storage: Our premium pet carrier is quite scratch-resistant and sturdy for long lasting use. You can also rest assured that it is strong enough to stand up to the scratches or gnawing of your pets","Pet Backpack Dimensions: 12.6"" L x 11.4"" W x 16.5"" H. Perfect for dogs up to 15-pounds, or cats up to 18-pounds. Easily fits cats, small dogs, and most other small/medium-sized pets! Please make sure your pet sits within 14.5 inches overall height and 12 inches wide Breathable & Perspective: Three side was made of PVC mesh for the carriers. Well ventilated design for optimal airflow and checking on pet",texsens-innovative-traveler-bubble-backpack-pet-carriers-for-cats-and-dogs-black
B0CSSRPTLT,"FUKUMARU Cat Scratcher Mat, 23.6 X 15.7 Inch Natural Sisal Cat Scratch Mats, Horizontal Cat Floor Scratching Pad Rug with Sticky Tapes, Protect Sofa and Carpet",Scratchers,11.79,https://m.media-amazon.com/images/I/71RqPxMK7lL._AC_UL320_.jpg,https://www.amazon.com/dp/B0CSSRPTLT?tag=captaincatnip-20,Trusted Amazon-listed product|Highly rated by cat owners|Ships fast via Amazon,"FUKUMARU Cat Scratcher Mat, 23.6 X 15.7 Inch Natural Sisal Cat Scratch Mats, Horizontal Cat Floor Scratching Pad Rug with Sticky Tapes, Protect Sofa and Carpet — a top-rated scratchers pick for cat parents. Order on Amazon with fast shipping.",fukumaru-cat-scratcher-mat-23-6-x-15-7-inch-natural-sisal-cat-scratch-mats-horiz
B0FSD5WXP3,"Interactive Cat Toys for Indoor Cats,[Newly Upgraded] Rechargeable Touch Activated Hide and Seek Kitten Toys for Bored Indoor Adult Cats with Fluttering (Blue)",Toys,24.97,https://m.media-amazon.com/images/I/81BkPMBXkKL._AC_SL1500_.jpg,https://www.amazon.com/dp/B0FSD5WXP3?tag=captaincatnip-20,"【Top-Tier Dual Interactive Fun】Qraxond's new indoor cat toy has dual motors, controlling random rotation of butterfly and plush tail swing rod accessories, bringing fun, exciting play for kittens and adult cats. 🎁Hide-and-Seek: The animal tail-shaped plush hides under the cover cloth, rotating irregularly to appear/disappear, creating a hide-and-seek game. It mimics real prey, bringing unpredictable chases to stimulate the cat’s brain and senses. 🦋Irregular Rotating Butterfly: The top has an auto-rotating butterfly that rotates, pauses or swings to simulate real flight, keeping the cat engaged. Various interactions ensure the cat gets enough exercise to avoid obesity.|【3 Adjustable Speed Modes】Customize the excitement with separate buttons for the butterfly and tail! Choose from 3 settings: Steady (Blue Light), Active (Purple Light), and Random (Yellow Light). Ideal for high-energy cats to burn off steam or for calm cats to enjoy gentle play. Keep your feline entertained and prevent boredom, especially when they are home alone.|【Touch-Sensitive Activation】Your Cat’s in Control! With smart touch-sensor technology, just tap the device to fire up the fun mode — it’ll kick off a 5-minute automatic play session instantly.Right after the play session ends, it switches directly to touch-sensitive standby mode, where the purple indicator light flashes every 20 seconds. Simply tap again to reactivate it for another 5-minute cycle. This smart loop not only ensures your cat gets sufficient exercise, but also prevents overstimulation.|【Large Rechargeable Battery】Enjoy long-lasting play with the built-in 2500mAh battery! It charges fully in just 2.5 hours via the included USB cable (use a 5V adapter only). The efficient auto on/off cycle extends battery life, making it convenient for busy pet owners while ensuring your cat gets healthy, moderate exercise.|【Realistic Bird Chirping】Elevate the hunt with lifelike sound! The built-in speaker emits authentic bird chirps to attract your cat’s attention and stimulate their prey drive. Combined with the random motions of the butterfly and tail, it creates an irresistible and engaging play experience that keeps your cat happily chasing even when they're by themselves.","【Top-Tier Dual Interactive Fun】Qraxond's new indoor cat toy has dual motors, controlling random rotation of butterfly and plush tail swing rod accessories, bringing fun, exciting play for kittens and adult cats. 🎁Hide-and-Seek: The animal tail-shaped plush hides under the cover cloth, rotating irregularly to appear/disappear, creating a hide-and-seek game. It mimics real prey, bringing unpredictable chases to stimulate the cat’s brain and senses. 🦋Irregular Rotating Butterfly: The top has an auto-rotating butterfly that rotates, pauses or swings to simulate real flight, keeping the cat engaged",interactive-cat-toys-for-indoor-cats-newly-upgraded-rechargeable-touch-activated
B0BZ835755,"rabbitgoo Escape Proof Cat Harness and Leash Set, M, Black | 4 Adjustable Points, Quick-snap Buckles, All-weather Mesh, Secure Clip, Reflective Strips, for Medium to Large Cats Outings",Collars,16.78,https://m.media-amazon.com/images/I/71RgpY2c+uL._AC_UL320_.jpg,https://www.amazon.com/dp/B0BZ835755?tag=captaincatnip-20,Trusted Amazon-listed product|Highly rated by cat owners|Ships fast via Amazon,"rabbitgoo Escape Proof Cat Harness and Leash Set, M, Black | 4 Adjustable Points, Quick-snap Buckles, All-weather Mesh, Secure Clip, Reflective Strips, for Medium to Large Cats Outings — a top-rated collars pick for cat parents. Order on Amazon with fast shipping.",rabbitgoo-escape-proof-cat-harness-and-leash-set-m-black-4-adjustable-points-qui
B000X1S9RW,"from The Field | Organic Catnip Leaf & Flower Blend for Cats & Kittens | Fresh USA-Grown, Highly Aromatic, Non-Toxic, Eco-Friendly | 3.5 oz Resealable Tub for Long-Lasting Potency & Active Playtime",Catnip,12.69,https://m.media-amazon.com/images/I/71pH69eqXlL._AC_SL1477_.jpg,https://www.amazon.com/dp/B000X1S9RW?tag=captaincatnip-20,"Fresh and Potent: Packed with premium leaf and flower cut for a highly aromatic, long-lasting catnip experience.|Proudly Made and Grown in the USA: Ensuring top-quality, safe catnip for your feline companion.|Convenient Resealable Tub: Keeps your catnip fresh for longer, easy to store and use.|Leaf and Flower Cut: A balanced mix of leaves and flowers for maximum potency.|Promotes Healthy Exercise: Encourages active play and mental stimulation, keeping cats entertained and fit.","Treat your cat to the finest Catnip Leaf and Flower with our resealable tub. Made from all-natural, USA-grown catnip, this blend contains a potent mix of leaves and flowers for maximum freshness and enjoyment. The convenient reclosable tub ensures long-lasting freshness, making it perfect for keeping your cat entertained and engaged. Proudly grown and harvested in the USA, this premium catnip is ideal for refreshing toys or encouraging playful activity.",from-the-field-organic-catnip-leaf-flower-blend-for-cats-kittens-fresh-usa-grown
B01N66Y1IK,"Pet Hair Remover Glove - Gentle Pet Grooming Glove Brush - Deshedding Glove - Massage Mitt with Enhanced Five Finger Design - Perfect for Dogs & Cats with Long & Short Fur - 1 Pack (Right-hand), Blue",Grooming,7.19,https://m.media-amazon.com/images/I/71JXORyFGEL._AC_UL320_.jpg,https://www.amazon.com/dp/B01N66Y1IK?tag=captaincatnip-20,Trusted Amazon-listed product|Highly rated by cat owners|Ships fast via Amazon,"Pet Hair Remover Glove - Gentle Pet Grooming Glove Brush - Deshedding Glove - Massage Mitt with Enhanced Five Finger Design - Perfect for Dogs & Cats with Long & Short Fur - 1 Pack (Right-hand), Blue — a top-rated grooming pick for cat parents. Order on Amazon with fast shipping.",pet-hair-remover-glove-gentle-pet-grooming-glove-brush-deshedding-glove-massage
B0FJFJR4GV,"XiaZ Cat Wall Shelves, Corner Cat Shelf with 3 Wide Perch Steps, Kitty Wall Climber Wooden Furniture up to 25lbs, Modern Floating Cats Stairs for Indoor Sleeping, Playing, Climbing",Furniture,34.99,https://m.media-amazon.com/images/I/71GO2OW5WtL._AC_UL320_.jpg,https://www.amazon.com/dp/B0FJFJR4GV?tag=captaincatnip-20,Trusted Amazon-listed product|Highly rated by cat owners|Ships fast via Amazon,"XiaZ Cat Wall Shelves, Corner Cat Shelf with 3 Wide Perch Steps, Kitty Wall Climber Wooden Furniture up to 25lbs, Modern Floating Cats Stairs for Indoor Sleeping, Playing, Climbing — a top-rated furniture pick for cat parents. Order on Amazon with fast shipping.",xiaz-cat-wall-shelves-corner-cat-shelf-with-3-wide-perch-steps-kitty-wall-climbe
B0B7RQTSB7,"Heybly Cat Tree with Toy, Cat Tower condo for Indoor Cats, Cat House with Padded Plush Perch, Cozy Hammock and Sisal Scratching Posts, Smoky Gray HCT004SG",Trees,35.99,https://m.media-amazon.com/images/I/71N99J8RxoL._AC_SL1500_.jpg,https://www.amazon.com/dp/B0B7RQTSB7?tag=captaincatnip-20,"Ideal design of structure: Structure of the cat tree is designed according the climbing habits of cats. Two jumping platforms not only increase the active space but also help kitties and older cats to climb up and down|Stability is the Primary Consideration for A Cat Tower: Sturdy cat climbing frame base, sisal wrapped scratch posts and Anti-toppling devices ensures the security of active kittens and cats playing on the activity centre|Spacious and Removable Top Perch: The well-padded top platform is suitable for kittens. They can lie on the soft place as a bed to sleep, observe and nap|Lazy Cats Favorite Basket: Cats naturally like the feeling of being wrapped , which makes them feel safe, therefore a comfortable and strong basket are always necessary|A Cat teasing stick and Plush Ball for Kittens to Play: The extra cat teaser stick increases the interactive fun of cat and its owner. The toy ball with bell do not make too much noise. It can meet the cats' play needs while not disturbing the owner","Ideal design of structure: Structure of the cat tree is designed according the climbing habits of cats. Two jumping platforms not only increase the active space but also help kitties and older cats to climb up and down Stability is the Primary Consideration for A Cat Tower: Sturdy cat climbing frame base, sisal wrapped scratch posts and Anti-toppling devices ensures the security of active kittens and cats playing on the activity centre",heybly-cat-tree-with-toy-cat-tower-condo-for-indoor-cats-cat-house-with-padded-p
B08CWY3TLW,"Oxyfresh Premium Pet Dental Care Solution Pet Water Additive: Best Way to Eliminate Bad Dog Breath and Cat Bad Breath - Fights Tartar & Plaque - So Easy, Just Add to Water! Vet Recommended 16 oz.",Health,18.95,https://m.media-amazon.com/images/I/61Ugh5bSNsL._AC_UL320_.jpg,https://www.amazon.com/dp/B08CWY3TLW?tag=captaincatnip-20,Trusted Amazon-listed product|Highly rated by cat owners|Ships fast via Amazon,"Oxyfresh Premium Pet Dental Care Solution Pet Water Additive: Best Way to Eliminate Bad Dog Breath and Cat Bad Breath - Fights Tartar & Plaque - So Easy, Just Add to Water! Vet Recommended 16 oz. — a top-rated health pick for cat parents. Order on Amazon with fast shipping.",oxyfresh-premium-pet-dental-care-solution-pet-water-additive-best-way-to-elimina
B08CY5VR5W,"Bedsure Cat Beds for Indoor Cats - Large Cat Cave for Pet Cat House with Fluffy Ball Hanging and Scratch Pad, Foldable Cat Hideaway, 16.5x16.5x13 inches, Grey",Beds,26.99,https://m.media-amazon.com/images/I/81hCdOyfk5L._AC_UL320_.jpg,https://www.amazon.com/dp/B08CY5VR5W?tag=captaincatnip-20,Trusted Amazon-listed product|Highly rated by cat owners|Ships fast via Amazon,"Bedsure Cat Beds for Indoor Cats - Large Cat Cave for Pet Cat House with Fluffy Ball Hanging and Scratch Pad, Foldable Cat Hideaway, 16.5x16.5x13 inches, Grey — a top-rated beds pick for cat parents. Order on Amazon with fast shipping.",bedsure-cat-beds-for-indoor-cats-large-cat-cave-for-pet-cat-house-with-fluffy-ba
B0009X29WK,Dr. Elsey's Ultra UnScented Clumping Clay Cat Litter 40 lb. Bag,Litter,20.99,https://m.media-amazon.com/images/I/71gV7T7iW-L._AC_UL320_.jpg,https://www.amazon.com/dp/B0009X29WK?tag=captaincatnip-20,Trusted Amazon-listed product|Highly rated by cat owners|Ships fast via Amazon,Dr. Elsey's Ultra UnScented Clumping Clay Cat Litter 40 lb. Bag — a top-rated litter pick for cat parents. Order on Amazon with fast shipping.,dr-elsey-s-ultra-unscented-clumping-clay-cat-litter-40-lb-bag
B006FTJ0NI,"Purina Friskies Wet Cat Food Variety Pack, Tasty Treasures Prime Filets (With Ocean Fish and Tuna, With Chicken and With Turkey) - 5.5 Ounce (Pack of 12)",Food,10.07,https://m.media-amazon.com/images/I/91Lxks7Ex6L._AC_UL320_.jpg,https://www.amazon.com/dp/B006FTJ0NI?tag=captaincatnip-20,Trusted Amazon-listed product|Highly rated by cat owners|Ships fast via Amazon,"Purina Friskies Wet Cat Food Variety Pack, Tasty Treasures Prime Filets (With Ocean Fish and Tuna, With Chicken and With Turkey) - 5.5 Ounce (Pack of 12) — a top-rated food pick for cat parents. Order on Amazon with fast shipping.",purina-friskies-wet-cat-food-variety-pack-tasty-treasures-prime-filets-with-ocea
B071J2W35W,"Greenies Cat Treats, Veterinarian-Recommended Adult Natural Dental Cat Treats, Tempting Tuna Flavor, 21 oz. Tub",Treats,22.98,https://m.media-amazon.com/images/I/81sG2otOyUL._AC_UL320_.jpg,https://www.amazon.com/dp/B071J2W35W?tag=captaincatnip-20,Trusted Amazon-listed product|Highly rated by cat owners|Ships fast via Amazon,"Greenies Cat Treats, Veterinarian-Recommended Adult Natural Dental Cat Treats, Tempting Tuna Flavor, 21 oz. Tub — a top-rated treats pick for cat parents. Order on Amazon with fast shipping.",greenies-cat-treats-veterinarian-recommended-adult-natural-dental-cat-treats-tem
B07MKSC82B,"Wonder Creature Cat Water Fountain with Stainless Steel Lid, 2.4L/81oz Automatic Cat Fountain with LED Light and Water Level Window for Cats and Dogs",Feeders,17.99,https://m.media-amazon.com/images/I/61Xpohgs-2L._AC_UL320_.jpg,https://www.amazon.com/dp/B07MKSC82B?tag=captaincatnip-20,Trusted Amazon-listed product|Highly rated by cat owners|Ships fast via Amazon,"Wonder Creature Cat Water Fountain with Stainless Steel Lid, 2.4L/81oz Automatic Cat Fountain with LED Light and Water Level Window for Cats and Dogs — a top-rated feeders pick for cat parents. Order on Amazon with fast shipping.",wonder-creature-cat-water-fountain-with-stainless-steel-lid-2-4l-81oz-automatic
B0BR7LHM3V,"Cawypety Cat Backpack Carrier, Breathable Cat Carrier Large Space Bubble Pet Backpack for Kitty Small Dog up to 15lbs, Transparent & Foldable Pet Carrier for Travel Hiking",Carriers,39.99,https://m.media-amazon.com/images/I/81VP87lUA6L._AC_SL1500_.jpg,https://www.amazon.com/dp/B0BR7LHM3V?tag=captaincatnip-20,"VENTILATED BACKPACK: With a breathable bubble window in the front, this clear pet backpack allows cats to enjoy the sun without feeling stuffy, there are exits on the side for pets to enter and exit, and you can also pet your kitten, which is the best ventilation in a space pack ever.|MORE SPACE AND FOLDABLE: Compared with others, our square design leaves enough space for cat (under 15 pounds)to turn around, besides, we design the backpack can be folded to very small package, and there are side pockets and hook holes, you will enjoy the greatest convenience when taking your cat out.|SAFETY & ANTI-SCRATCH: Made of 600d oxford cloth and nylon mesh, environmentally friendly and breathable. Not easily scratched by cat claws. There are protective films on the front and back of the shell, which is scratch-resistan, please watch our video to remove the membrane cleanly.|NO PRESSURE TO CARRY: The shoulder strap is equipped with a chest buckle to prevent the shoulder strap from falling, and the back is sewn with pearl cotton and breathable mesh, giving you a comfortable and breathable experience.|ANTI-ESCAPE AND DOUBLE SIDED CUSHION: Built-in harnesses keep your naughty friends from escaping, and the short plush cushion is double-sided for summer and winter. Can be disassembled and washed separately!","VENTILATED BACKPACK: With a breathable bubble window in the front, this clear pet backpack allows cats to enjoy the sun without feeling stuffy, there are exits on the side for pets to enter and exit, and you can also pet your kitten, which is the best ventilation in a space pack ever. MORE SPACE AND FOLDABLE: Compared with others, our square design leaves enough space for cat (under 15 pounds)to turn around, besides, we design the backpack can be folded to very small package, and there are side pockets and hook holes, you will enjoy the greatest convenience when taking your cat out.",cawypety-cat-backpack-carrier-breathable-cat-carrier-large-space-bubble-pet-back
B0B5SQMMJK,"Cat Scratching Post for Large Cats, Cat Scratcher for Indoor Cats Adults, Sturdy Sisal Scratch Post to Protect Furniture, 32 Inch, Beige",Scratchers,38.39,https://m.media-amazon.com/images/I/61mnG6MveML._AC_UL320_.jpg,https://www.amazon.com/dp/B0B5SQMMJK?tag=captaincatnip-20,Trusted Amazon-listed product|Highly rated by cat owners|Ships fast via Amazon,"Cat Scratching Post for Large Cats, Cat Scratcher for Indoor Cats Adults, Sturdy Sisal Scratch Post to Protect Furniture, 32 Inch, Beige — a top-rated scratchers pick for cat parents. Order on Amazon with fast shipping.",cat-scratching-post-for-large-cats-cat-scratcher-for-indoor-cats-adults-sturdy-s
B07YKRPYJH,"Tempcore Pet Cat Tunnel Tube Toys 3 Way Collapsible, Tunnels for Indoor Cats, Interactive Tube with Teaser Wand, Peek Holes & Hanging Ball, Black & Blue",Toys,9.99,https://m.media-amazon.com/images/I/61FN+6TrJWL._AC_SL1500_.jpg,https://www.amazon.com/dp/B07YKRPYJH?tag=captaincatnip-20,"Best Ways to Play: Our cat tunnel with 3 spacious tunnels, peephole & ball toy, this popular cat toy gives your kitty more ways to have fun. Provides hours of exercise & self-amusement. This cat tunnel is more suitable for kittens and is made of polyester material.|Durable Construction: This cat tunnels for indoor cats use polyester fabric material design, not easy to scratch, sturdy spring steel frame, with protective end, Can play hide and seek game.|Collapsible & portable: Our cat tunnel folds down small in seconds for easy travel and storage. Each tube is about 10 inches tall and 17 inches deep.Take the entertainment with you anywhere, so your pet is never bored!|Keep Your Pet Active: Compared to cat tents, scratch posts, mouse toys etc, our kitty tunnel offers the most interactive fun with the dangling ball on the exits, truly a great way to encourage daily exercise and keep your pet active.|Buy With Confidence! ""A perfect cat toy, My cat plays for hours."" if you (or your pet) aren't thrilled with our cat tunnel, simply let us know for a full and prompt replacement or refund. There's no risk to buy now.","Best Ways to Play: Our cat tunnel with 3 spacious tunnels, peephole & ball toy, this popular cat toy gives your kitty more ways to have fun. Provides hours of exercise & self-amusement. This cat tunnel is more suitable for kittens and is made of polyester material. Durable Construction: This cat tunnels for indoor cats use polyester fabric material design, not easy to scratch, sturdy spring steel frame, with protective end, Can play hide and seek game.",tempcore-pet-cat-tunnel-tube-toys-3-way-collapsible-tunnels-for-indoor-cats-inte
B07SC7WFQN,"rabbitgoo Escape Proof Cat Harness and Leash Set, Xs, Black | 4 Adjustable Points, Quick-snap Buckles, All-weather Mesh, Secure Clip, Reflective Strips, for Small & Average Cats Outings",Collars,13.58,https://m.media-amazon.com/images/I/71hEWlH2-hL._AC_SL1500_.jpg,https://www.amazon.com/dp/B07SC7WFQN?tag=captaincatnip-20,"Escape-proof Cat Harness for Small to Average Cats: Securely fits neck 8.5-11"" and chest 13.5-16""—please confirm your pet's measurements using the size chart for a purrfect match. A minumium head circumference of 8.9"" helps prevent slipping out. Package includes: 1 x Harness and 1 x 4.9ft Leash|Cloud-light Comfort: Made with ultra-soft air-mesh, this breathable harness keeps your kitty cool and comfy on sunny strolls. Its vest design effectively redirects leash pressure away from the throat, preventing choking risks for worry-free fun|Guard Your Explorer: Clip the leash to the reinforced back D-ring for reliable control. Reflective strips enhance visibility in low light, while sturdy dual buckles keep the harness securely in place—blending adventurous freedom with confident safety on every outing|Ready in Seconds: Simply slip the harness over your cat's head, adjust the four straps for a custom fit, and secure the dual quick-release buckles in one swift motion – freeing up more precious meowments with your feline friend!|Universal Companionship: Designed for most breeds and ages, this cat harness set is ideal for cozy indoor moments, exciting outdoor explorations, or reassuring vet visits. Vibrant colours also celebrate your cat's unique style","Escape-proof Cat Harness for Small to Average Cats: Securely fits neck 8.5-11"" and chest 13.5-16""—please confirm your pet's measurements using the size chart for a purrfect match. A minumium head circumference of 8.9"" helps prevent slipping out. Package includes: 1 x Harness and 1 x 4.9ft Leash Cloud-light Comfort: Made with ultra-soft air-mesh, this breathable harness keeps your kitty cool and comfy on sunny strolls. Its vest design effectively redirects leash pressure away from the throat, preventing choking risks for worry-free fun",rabbitgoo-escape-proof-cat-harness-and-leash-set-xs-black-4-adjustable-points-qu
B01G3IBQIC,"from The Field | Ultimate Blend Catnip & Silver Vine | Premium USA-Grown Catnip for Toys & Playtime | Fresh, Potent, Non-Toxic, Eco-Friendly | Safe for Kittens & Cats | Resealable 2 Oz Tub",Catnip,8.99,https://m.media-amazon.com/images/I/61hKdhCEezL._AC_SL1100_.jpg,https://www.amazon.com/dp/B01G3IBQIC?tag=captaincatnip-20,"Perfect Harmony: Experience our Ultimate Blend, a premium mix of Silver Vine and our signature all-natural catnip, guaranteed to delight your cat.|American Quality: Proudly made in the USA, ensuring high-quality, safe playtime for your beloved pets. A perfect addition to enhance your indoor cat's playtime and toy collection.|Dual Delight: Combines the euphoric effects of Silver Vine with the enticing aroma of catnip, perfect for cats who are typically indifferent to catnip alone.|Rich in Natural Oils: Packed with essential oils and blooming with natural Nepetalactone, our catnip is fresh, powerful, and perfect for easing stress, promoting healthy exercise, and supporting your cat's mental health.|CAPTIVATE YOUR CAT with aromatic From the Field Catnip. Fresh, potent and non-toxic, it gives your feline a euphoric feeling that may help ease stress and encourage exercise for overall well-being.","Unleash pure delight for your cat with our Ultimate Blend tub, a premium mixture of Silver Vine and our all-natural catnip. Perfect for revitalizing old toys or sparking new play adventures, this blend is designed to captivate even the most indifferent felines. The compact, resealable tub ensures lasting freshness and easy storage. Made in the USA, our Ultimate Blend is the perfect choice for cat owners looking to provide their pets with safe, stimulating, and enjoyable playtime. Get ready to watch your cat leap, pounce, and purr with happiness!",from-the-field-ultimate-blend-catnip-silver-vine-premium-usa-grown-catnip-for-to
B01N9KSITZ,"Upgrade Efficient Pet Hair Remover Gloves - Gentle Shedding Brushes for Dogs, Cats & Horses with Long and Short Hair - 1 Pair (Blue)",Grooming,12.99,https://m.media-amazon.com/images/I/71JhGlBvyjL._AC_UL320_.jpg,https://www.amazon.com/dp/B01N9KSITZ?tag=captaincatnip-20,Trusted Amazon-listed product|Highly rated by cat owners|Ships fast via Amazon,"Upgrade Efficient Pet Hair Remover Gloves - Gentle Shedding Brushes for Dogs, Cats & Horses with Long and Short Hair - 1 Pair (Blue) — a top-rated grooming pick for cat parents. Order on Amazon with fast shipping.",upgrade-efficient-pet-hair-remover-gloves-gentle-shedding-brushes-for-dogs-cats
B0DRVMY62Y,"FUKUMARU Cat Wall Shelves, 2 Platform Cats Walls Furniture, Tree Shape Kitten Floating Shelf with Soft Cushion Perch, Solid Rubber Wood for 16 Inch Drywall, Suitable for Climb, Play, Nap",Furniture,53.80,https://m.media-amazon.com/images/I/61cxqtSZQAL._AC_UL320_.jpg,https://www.amazon.com/dp/B0DRVMY62Y?tag=captaincatnip-20,Trusted Amazon-listed product|Highly rated by cat owners|Ships fast via Amazon,"FUKUMARU Cat Wall Shelves, 2 Platform Cats Walls Furniture, Tree Shape Kitten Floating Shelf with Soft Cushion Perch, Solid Rubber Wood for 16 Inch Drywall, Suitable for Climb, Play, Nap — a top-rated furniture pick for cat parents. Order on Amazon with fast shipping.",fukumaru-cat-wall-shelves-2-platform-cats-walls-furniture-tree-shape-kitten-floa
